{
  "locale": "zh-Hant",
  "language": "Traditional Chinese",
  "nativeName": "繁體中文",
  "textDirection": "ltr",
  "version": 1,
  "strings": {
    "app.name": "Twinskaraoke",
    "app.shortName": "Twinskaraoke",
    "app.tagline": "和你喜愛的曲庫一起開唱。",
    "app.loading": "正在載入 Twinskaraoke",
    "common.about": "關於",
    "common.account": "帳號",
    "common.add": "加入",
    "common.addSong": "加入歌曲",
    "common.addToLibrary": "加入資料庫",
    "common.addToPlaylist": "加入播放列表",
    "common.album": "專輯",
    "common.albums": "專輯",
    "common.artist": "藝人",
    "common.artists": "藝人",
    "common.back": "返回",
    "common.browse": "瀏覽",
    "common.cancel": "取消",
    "common.clear": "清除",
    "common.close": "關閉",
    "common.collection": "收藏",
    "common.continue": "繼續",
    "common.copy": "複製",
    "common.default": "預設",
    "common.done": "完成",
    "common.download": "下載",
    "common.downloaded": "已下載",
    "common.edit": "編輯",
    "common.error": "錯誤",
    "common.favorite": "喜好項目",
    "common.favorites": "喜好項目",
    "common.hide": "隱藏",
    "common.library": "資料庫",
    "common.loading": "載入中",
    "common.more": "更多",
    "common.new": "新內容",
    "common.next": "下一首",
    "common.off": "關閉",
    "common.on": "開啟",
    "common.open": "開啟",
    "common.pause": "暫停",
    "common.play": "播放",
    "common.playNext": "接著播放",
    "common.playNow": "立即播放",
    "common.playlists": "播放列表",
    "common.previous": "上一首",
    "common.remove": "移除",
    "common.retry": "重試",
    "common.save": "儲存",
    "common.saved": "已儲存",
    "common.search": "搜尋",
    "common.settings": "設定",
    "common.share": "分享",
    "common.shuffle": "隨機播放",
    "common.signIn": "登入",
    "common.signOut": "登出",
    "common.skip": "跳過",
    "common.song": "歌曲",
    "common.songCount": "%d 首歌曲",
    "common.songCountOne": "1 首歌曲",
    "common.songs": "歌曲",
    "common.stop": "停止",
    "common.sync": "同步",
    "common.tryAgain": "重試",
    "navigation.collection": "收藏",
    "navigation.discover": "探索",
    "navigation.home": "首頁",
    "navigation.library": "資料庫",
    "navigation.new": "新內容",
    "navigation.radio": "廣播",
    "navigation.search": "搜尋",
    "home.title": "首頁",
    "home.listenNow": "立即聆聽",
    "home.topPicks": "為你精選",
    "home.recentlyPlayed": "最近播放",
    "home.madeForYou": "為你推薦",
    "home.latestSingle": "最新單曲",
    "home.newReleases": "新發行",
    "home.moreToExplore": "更多探索",
    "home.trending": "熱門",
    "home.trendingSongs": "熱門歌曲",
    "home.statusReady": "準備播放",
    "home.statusPlaying": "正在播放 %@",
    "home.emptyTitle": "這裡還沒有內容",
    "home.emptyMessage": "收聽後，你的推薦會顯示在這裡。",
    "new.title": "新內容",
    "new.upNext": "接下來",
    "new.bestNewSongs": "最佳新歌",
    "new.newThisWeek": "本週新歌",
    "new.recentlyReleased": "最近發行",
    "new.featured": "精選",
    "radio.title": "廣播",
    "radio.live": "直播",
    "radio.liveRadio": "直播廣播",
    "radio.liveSchedule": "直播節目表",
    "radio.featuredEpisode": "精選節目",
    "radio.playLiveStation": "播放直播電台",
    "radio.pauseLiveStation": "暫停直播電台",
    "radio.showLiveSchedule": "顯示直播節目表",
    "radio.refreshMetadata": "重新整理中繼資料",
    "radio.metadataUnavailable": "暫時無法取得廣播資訊。",
    "radio.upNext": "接下來",
    "radio.recentlyPlayed": "最近播放",
    "radio.onAir": "正在直播",
    "radio.listenersCount": "%d 位聽眾",
    "radio.liveStatus": "正在直播",
    "library.title": "資料庫",
    "library.playlists": "播放列表",
    "library.artists": "藝人",
    "library.albums": "專輯",
    "library.songs": "歌曲",
    "library.downloaded": "已下載",
    "library.videoGallery": "影片圖庫",
    "library.artGallery": "藝術圖庫",
    "library.composers": "作曲者",
    "library.compilations": "合輯",
    "library.randomSongs": "隨機歌曲",
    "library.recentlyAdded": "最近加入",
    "library.noSongs": "沒有歌曲",
    "library.noSongsMessage": "加入資料庫的歌曲會顯示在這裡。",
    "library.noDownloads": "沒有下載",
    "library.noDownloadsMessage": "已下載歌曲會顯示在這裡，供離線聆聽。",
    "playlist.addToPlaylist": "加入播放列表",
    "playlist.newPlaylist": "新增播放列表",
    "playlist.createPlaylist": "建立播放列表",
    "playlist.public": "公開播放列表",
    "playlist.private": "私人播放列表",
    "playlist.noPlaylists": "沒有播放列表",
    "playlist.noPlaylistsMessage": "播放列表會顯示在這裡。",
    "playlist.noResults": "沒有結果",
    "playlist.noResultsMessage": "試試其他播放列表名稱。",
    "playlist.songCount": "%d 首歌曲",
    "playlist.songCountOne": "1 首歌曲",
    "playlist.namePlaceholder": "播放列表名稱",
    "search.title": "搜尋",
    "search.prompt": "歌曲、藝人、歌詞等",
    "search.resultsFor": "「%@」的結果",
    "search.noResults": "沒有結果",
    "search.noResultsMessage": "沒有符合「%@」的歌曲。",
    "search.noResultsWatchMessage": "試試其他歌名或藝人。",
    "search.exploreInstead": "改為探索",
    "search.topResults": "最佳結果",
    "search.topCharts": "排行榜",
    "search.publicPlaylists": "公開播放列表",
    "search.loadingSongs": "正在載入歌曲",
    "search.unavailable": "搜尋不可用",
    "search.clear": "清除搜尋",
    "search.findWatch": "尋找卡拉 OK 歌曲、藝人和新的喜好項目。",
    "player.nowPlaying": "正在播放",
    "player.playback": "播放",
    "player.play": "播放",
    "player.pause": "暫停",
    "player.resume": "繼續",
    "player.skip": "跳過",
    "player.previous": "上一首",
    "player.volume": "音量",
    "player.airPlay": "AirPlay",
    "player.favorite": "加入喜好項目",
    "player.removeFavorite": "從喜好項目中移除",
    "player.download": "下載",
    "player.removeDownload": "移除下載",
    "player.cancelDownload": "取消下載",
    "player.showLyrics": "顯示歌詞",
    "player.hideLyrics": "隱藏歌詞",
    "player.showQueue": "顯示接著播放",
    "player.more": "更多",
    "player.artwork": "封面",
    "player.shareArtwork": "分享封面",
    "player.saveArtwork": "儲存封面",
    "player.viewArtwork": "檢視",
    "player.openPlayer": "開啟播放器",
    "lyrics.title": "歌詞",
    "lyrics.noLyrics": "沒有歌詞",
    "lyrics.noLyricsMessage": "這首歌暫無歌詞。",
    "lyrics.loading": "正在載入歌詞",
    "lyrics.failed": "歌詞不可用",
    "lyrics.showTranslations": "顯示翻譯",
    "lyrics.hideTranslations": "隱藏翻譯",
    "queue.title": "接著播放",
    "queue.queue": "佇列",
    "queue.clear": "清空佇列",
    "queue.emptyTitle": "沒有排隊歌曲",
    "queue.emptyMessage": "接下來播放的歌曲會顯示在這裡。",
    "queue.songQueued": "%d 首歌曲已排隊",
    "queue.songQueuedOne": "1 首歌曲已排隊",
    "queue.upNext": "接下來",
    "queue.queuedPosition": "佇列中第 %d 首，共 %d 首",
    "queue.skipCurrent": "跳過目前歌曲",
    "queue.autoplay": "自動播放",
    "queue.repeat": "重複",
    "queue.autoMix": "自動混音",
    "account.title": "帳號",
    "account.profile": "個人檔案",
    "account.guestListener": "訪客聽眾",
    "account.notSignedIn": "未登入",
    "account.signInPrompt": "登入以存取你的資料庫",
    "account.signInOnWeb": "在網頁上登入",
    "account.signOutTitle": "登出？",
    "account.signOutMessage": "你需要重新登入才能存取資料庫和帳號功能。",
    "account.notifications": "通知",
    "account.about": "關於",
    "account.guestId": "訪客 ID",
    "account.revealId": "顯示 ID",
    "account.hideId": "隱藏 ID",
    "account.service": "服務",
    "account.globalCdn": "全球 CDN",
    "account.chinaCdn": "中國 CDN",
    "account.guestPlayback": "訪客播放",
    "account.guestPlaybackReady": "已可瀏覽、收聽廣播和播放卡拉 OK 歌曲",
    "auth.signInTitle": "登入 Twinskaraoke",
    "auth.signInSubtitle": "跨裝置存取你的資料庫、喜好項目和播放列表。",
    "auth.username": "使用者名稱",
    "auth.password": "密碼",
    "auth.showPassword": "顯示密碼",
    "auth.hidePassword": "隱藏密碼",
    "auth.signingIn": "正在登入",
    "auth.continueWithDiscord": "使用 Discord 繼續",
    "auth.terms": "繼續即表示你同意 Twinskaraoke 的服務條款和隱私權政策。",
    "auth.error": "登入錯誤",
    "settings.title": "音樂",
    "settings.readyToPlay": "準備播放",
    "settings.tunePlayback": "調整 Twinskaraoke 播放體驗",
    "settings.library": "資料庫",
    "settings.addPlaylistSongs": "加入播放列表歌曲",
    "settings.addFavoriteSongs": "加入喜好歌曲",
    "settings.syncLibrary": "同步資料庫",
    "settings.libraryFooter": "當你把歌曲加入播放列表或喜好項目時，將歌曲加入資料庫。同步會讓資料庫更改在此 App 的各裝置間可用。",
    "settings.audio": "音訊",
    "settings.autoMix": "自動混音",
    "settings.crossfade": "交叉淡入淡出",
    "settings.autoplaySimilar": "自動播放相似歌曲",
    "settings.audioQuality": "音質",
    "settings.highEfficiency": "高效率",
    "settings.highQuality": "高品質",
    "settings.lossless": "無損",
    "settings.audioFooter": "自動混音會自動銜接相容歌曲。交叉淡入淡出使用你選擇的固定時長。",
    "settings.downloads": "下載",
    "settings.autoDownloadPlayed": "自動下載已播放歌曲",
    "settings.downloadsFooter": "開啟後，你播放的歌曲會儲存以供離線聆聽。",
    "settings.lyrics": "歌詞",
    "settings.respectReduceMotion": "遵循減少動態效果",
    "settings.lyricsFooter": "動態歌詞和轉場會遵循你的動態效果偏好。",
    "settings.appearance": "外觀",
    "settings.theme": "主題",
    "settings.developer": "開發者",
    "settings.equalizer": "等化器",
    "settings.resetEqualizer": "重置等化器",
    "settings.equalizerFooter": "10 段參數等化器。拖曳每個頻段在 -12 dB 到 +12 dB 之間調整。",
    "settings.aiAudio": "AI 音訊",
    "settings.aiAudioProcessing": "AI 音訊處理",
    "settings.autoAnalyze": "播放時自動分析",
    "settings.autoAnalyzeTitle": "開啟播放時自動分析？",
    "settings.autoAnalyzeAction": "開啟",
    "settings.autoAnalyzeMessage": "歌曲將在背景分析，這樣播放時可以即時切換卡拉 OK 模式。\n\n這會使用更多電量和處理能力。分離後的人聲/伴奏會計入 4 GB 音樂快取限制。",
    "settings.karaoke": "卡拉 OK",
    "settings.vocalRemoval": "人聲消除",
    "settings.removalLevel": "消除級別",
    "settings.vocalRemovalLevel": "人聲消除級別",
    "settings.bassEnhance": "低音增強",
    "settings.vocalEnhance": "人聲增強",
    "settings.instrumentalEnhance": "伴奏增強",
    "settings.strength": "強度",
    "settings.processingUnavailable": "目前歌曲的背景處理完成後可用。",
    "settings.karaokeFooter": "卡拉 OK 效果使用裝置端 AI 即時分離人聲和伴奏。為了獲得最佳效果，請使用耳機或外接揚聲器。",
    "settings.storage": "儲存空間",
    "settings.imageCache": "圖片快取",
    "settings.musicCache": "音樂快取",
    "settings.lyricsCache": "歌詞快取",
    "settings.removeAllDownloads": "移除所有下載",
    "settings.clearRecentlyPlayed": "清除最近播放",
    "settings.offlineSongsOnDevice": "此裝置上的離線歌曲",
    "settings.listeningHistoryOnDevice": "此裝置上的聆聽記錄",
    "settings.storageFooter": "點一下指示項可清除對應快取。圖片快取上限為 2 GB，音樂快取（包含 AI 分軌）上限為 4 GB，歌詞快取上限為 2 GB。超過 6 個月的項目會自動清理。下載內容不受這些限制影響。",
    "settings.maximum": "最大",
    "settings.strong": "強",
    "settings.medium": "中等",
    "settings.light": "輕",
    "settings.almostOff": "幾乎關閉",
    "profile.achievements": "成就",
    "profile.badgesUnlocked": "%@ 枚徽章已解鎖",
    "profile.keepSinging": "繼續演唱，完成你的個人檔案收藏。",
    "profile.nextBadge": "下一枚徽章",